{
  "$schema": "https://json-schema.org/draft/2020-12/schema",
  "title": "RFC-JOSH-0002 Version 1 Conformance Fixture",
  "description": "Language-neutral conformance fixture for RFC-JOSH-0002 version 1.",
  "type": "object",
  "additionalProperties": false,
  "required": [
    "id",
    "description",
    "role",
    "conformance",
    "rfc_sections",
    "origin",
    "exchanges",
    "expected"
  ],
  "properties": {
    "id": {
      "type": "string",
      "pattern": "^[a-z0-9]+(?:-[a-z0-9]+)*$"
    },
    "description": {
      "type": "string",
      "minLength": 1
    },
    "role": {
      "type": "string",
      "enum": [
        "consumer",
        "publisher"
      ]
    },
    "conformance": {
      "type": "string",
      "enum": [
        "required",
        "recommended",
        "optional-capability"
      ]
    },
    "capability": {
      "type": "string",
      "enum": [
        "same-origin-redirects"
      ]
    },
    "rfc_sections": {
      "type": "array",
      "minItems": 1,
      "uniqueItems": true,
      "items": {
        "type": "string",
        "enum": [
          "1",
          "2",
          "3",
          "3.1",
          "3.2",
          "4",
          "5",
          "6",
          "7",
          "7.1",
          "7.2",
          "7.3",
          "8",
          "9",
          "10",
          "11",
          "12",
          "13",
          "14",
          "15",
          "16",
          "17",
          "18",
          "19",
          "20",
          "21",
          "22",
          "23"
        ]
      }
    },
    "origin": {
      "type": "string",
      "format": "uri",
      "pattern": "^https?://[^/?#@\\s]+$"
    },
    "exchanges": {
      "type": "array",
      "minItems": 1,
      "items": {
        "$ref": "#/$defs/exchange"
      }
    },
    "expected": {
      "$ref": "#/$defs/expected"
    }
  },
  "allOf": [
    {
      "if": {
        "properties": {
          "conformance": {
            "const": "optional-capability"
          }
        },
        "required": [
          "conformance"
        ]
      },
      "then": {
        "required": [
          "capability"
        ]
      },
      "else": {
        "not": {
          "required": [
            "capability"
          ]
        }
      }
    }
  ],
  "$defs": {
    "exchange": {
      "type": "object",
      "additionalProperties": false,
      "required": [
        "request"
      ],
      "properties": {
        "request": {
          "$ref": "#/$defs/request"
        },
        "response": {
          "$ref": "#/$defs/response"
        },
        "failure": {
          "$ref": "#/$defs/failure"
        }
      },
      "oneOf": [
        {
          "required": [
            "response"
          ],
          "not": {
            "required": [
              "failure"
            ]
          }
        },
        {
          "required": [
            "failure"
          ],
          "not": {
            "required": [
              "response"
            ]
          }
        }
      ]
    },
    "request": {
      "type": "object",
      "additionalProperties": false,
      "required": [
        "method",
        "uri"
      ],
      "properties": {
        "method": {
          "const": "GET"
        },
        "uri": {
          "type": "string",
          "format": "uri",
          "pattern": "^https?://[^\\s]+$"
        }
      }
    },
    "response": {
      "type": "object",
      "additionalProperties": false,
      "required": [
        "status",
        "body"
      ],
      "properties": {
        "status": {
          "type": "integer",
          "minimum": 100,
          "maximum": 599
        },
        "headers": {
          "type": "array",
          "items": {
            "$ref": "#/$defs/header"
          }
        },
        "body": {
          "type": "string"
        }
      }
    },
    "header": {
      "type": "object",
      "additionalProperties": false,
      "required": [
        "name",
        "value"
      ],
      "properties": {
        "name": {
          "type": "string",
          "minLength": 1
        },
        "value": {
          "type": "string"
        }
      }
    },
    "failure": {
      "type": "object",
      "additionalProperties": false,
      "required": [
        "kind"
      ],
      "properties": {
        "kind": {
          "type": "string",
          "enum": [
            "dns",
            "tls",
            "timeout",
            "transport"
          ]
        }
      }
    },
    "expected": {
      "oneOf": [
        {
          "$ref": "#/$defs/expected-valid-v1"
        },
        {
          "$ref": "#/$defs/expected-invalid"
        },
        {
          "$ref": "#/$defs/expected-unsupported-version"
        },
        {
          "$ref": "#/$defs/expected-absent"
        },
        {
          "$ref": "#/$defs/expected-temporary-failure"
        },
        {
          "$ref": "#/$defs/expected-cross-origin-redirect"
        }
      ]
    },
    "expected-valid-v1": {
      "type": "object",
      "additionalProperties": false,
      "required": [
        "declaration",
        "participation",
        "identity"
      ],
      "properties": {
        "declaration": {
          "const": "valid-v1"
        },
        "participation": {
          "const": "declared"
        },
        "identity": {
          "type": "string",
          "enum": [
            "affirmed",
            "declined",
            "undeclared"
          ]
        }
      }
    },
    "expected-invalid": {
      "type": "object",
      "additionalProperties": false,
      "required": [
        "declaration",
        "participation",
        "identity"
      ],
      "properties": {
        "declaration": {
          "const": "invalid"
        },
        "participation": {
          "const": "not-declared"
        },
        "identity": {
          "const": "not-applicable"
        }
      }
    },
    "expected-unsupported-version": {
      "type": "object",
      "additionalProperties": false,
      "required": [
        "declaration",
        "participation",
        "identity"
      ],
      "properties": {
        "declaration": {
          "const": "unsupported-version"
        },
        "participation": {
          "const": "indeterminate"
        },
        "identity": {
          "const": "not-applicable"
        }
      }
    },
    "expected-absent": {
      "type": "object",
      "additionalProperties": false,
      "required": [
        "declaration",
        "participation",
        "identity"
      ],
      "properties": {
        "declaration": {
          "const": "absent"
        },
        "participation": {
          "const": "not-declared"
        },
        "identity": {
          "const": "not-applicable"
        }
      }
    },
    "expected-temporary-failure": {
      "type": "object",
      "additionalProperties": false,
      "required": [
        "declaration",
        "participation",
        "identity"
      ],
      "properties": {
        "declaration": {
          "const": "temporary-failure"
        },
        "participation": {
          "const": "indeterminate"
        },
        "identity": {
          "const": "not-applicable"
        }
      }
    },
    "expected-cross-origin-redirect": {
      "type": "object",
      "additionalProperties": false,
      "required": [
        "declaration",
        "participation",
        "identity"
      ],
      "properties": {
        "declaration": {
          "const": "cross-origin-redirect"
        },
        "participation": {
          "const": "not-declared"
        },
        "identity": {
          "const": "not-applicable"
        }
      }
    }
  }
}
