{
  "id": "josh-null",
  "description": "A version 1 declaration whose josh member is null instead of a boolean.",
  "role": "consumer",
  "conformance": "required",
  "rfc_sections": [
    "7",
    "8",
    "12"
  ],
  "origin": "https://example.invalid",
  "exchanges": [
    {
      "request": {
        "method": "GET",
        "uri": "https://example.invalid/.well-known/josh"
      },
      "response": {
        "status": 200,
        "headers": [
          {
            "name": "Content-Type",
            "value": "application/json"
          }
        ],
        "body": "{\"version\":1,\"josh\":null}"
      }
    }
  ],
  "expected": {
    "declaration": "invalid",
    "participation": "not-declared",
    "identity": "not-applicable"
  }
}
