{
  "id": "version-fraction",
  "description": "A declaration whose version uses a fractional JSON number instead of the required integer syntax.",
  "role": "consumer",
  "conformance": "required",
  "rfc_sections": [
    "6",
    "8",
    "12"
  ],
  "origin": "https://example.invalid",
  "exchanges": [
    {
      "request": {
        "method": "GET",
        "uri": "https://example.invalid/.well-known/josh"
      },
      "response": {
        "status": 200,
        "headers": [
          {
            "name": "Content-Type",
            "value": "application/json"
          }
        ],
        "body": "{\"version\":1.0}"
      }
    }
  ],
  "expected": {
    "declaration": "invalid",
    "participation": "not-declared",
    "identity": "not-applicable"
  }
}
